<?xml version="1.0" encoding="UTF-8"?>
<xs:schema attributeFormDefault="unqualified" elementFormDefault="qualified" xmlns:xs="http://www.w3.org/2001/XMLSchema">
  <xs:element name="paramWeight">
    <xs:complexType>
      <xs:sequence>
        <xs:element name="timeState" maxOccurs="unbounded" minOccurs="0">
          <xs:complexType>
            <xs:sequence>
              <xs:element type="xs:float" name="tau" minOccurs="0"/>
              <xs:element type="xs:float" name="lambda"/>
              <xs:element type="xs:float" name="delta"/>
              <xs:element type="xs:float" name="wm" minOccurs="0"/>
              <xs:element type="xs:float" name="ws" minOccurs="0"/>
              <xs:element type="xs:float" name="we" minOccurs="0"/>
              <xs:element type="xs:float" name="wn" minOccurs="0"/>
              <xs:element type="xs:float" name="wp" minOccurs="0"/>
            </xs:sequence>
            <xs:attribute type="xs:string" name="id" use="optional"/>
          </xs:complexType>
        </xs:element>
      </xs:sequence>
    </xs:complexType>
  </xs:element>
</xs:schema>
